Iteration,Variant 1 - Basic Transcript,Variant 1 - Basic Child Attributes,Variant 1 - Basic Parent Attributes,Variant 2 - Query + Reddit Context Transcript,Variant 2 - Query + Reddit Context Child Attributes,Variant 2 - Query + Reddit Context Parent Attributes,Variant 3 - Query + Guidelines Transcript,Variant 3 - Query + Guidelines Child Attributes,Variant 3 - Query + Guidelines Parent Attributes,Variant 4 - Query + User Profiles Transcript,Variant 4 - Query + User Profiles Child Attributes,Variant 4 - Query + User Profiles Parent Attributes,Variant 5 - Query + Context + Guidelines Transcript,Variant 5 - Query + Context + Guidelines Child Attributes,Variant 5 - Query + Context + Guidelines Parent Attributes,Variant 6 - Query + Context + User Profiles Transcript,Variant 6 - Query + Context + User Profiles Child Attributes,Variant 6 - Query + Context + User Profiles Parent Attributes,Variant 7 - Query + Guidelines + User Profiles Transcript,Variant 7 - Query + Guidelines + User Profiles Child Attributes,Variant 7 - Query + Guidelines + User Profiles Parent Attributes,Variant 8 - Query + Context + Guidelines + User Profiles Transcript,Variant 8 - Query + Context + Guidelines + User Profiles Child Attributes,Variant 8 - Query + Context + Guidelines + User Profiles Parent Attributes
1,"Parent: Hey buddy, I wanted to talk to you about something important. You might have heard the term ""virginity"" before, and it's often discussed as a big deal. Basically, it refers to whether someone has had sex or not. It's okay to have questions and feel curious about it. Everyone's experience is different, and it's important to make choices that are right for you, respecting yourself and others. If you ever want to talk or ask questions, I'm here for you.
Child: Um, okay. I've heard about it a bit online. Thanks for letting me know I can ask questions.
Parent: Of course, I'm glad you feel comfortable asking questions. It's important to remember that virginity is a personal concept and means different things to different people. It’s okay to take your time to understand what it means to you. If you ever feel pressured or unsure, it's perfectly fine to talk to me or someone you trust about it. Your choices should always be based on what feels right for you, respecting yourself and others.
Child: Child: Yeah, I get it. Thanks for being cool about it, Mom. I'll let you know if I think of anything.",,,"Parent: Hey bud, I want to talk to you about something that might seem a bit awkward, but it's important. You know, virginity is often talked about like it's this huge deal, but I want you to know that it's really okay to have your own thoughts about it. Some people think it's something to treasure, while others feel it's not such a big deal. What's most important is how you feel about it and making sure any decisions you make are respectful and safe. If you have questions or need advice, I'm always here to chat.
Child: Yeah, I get it, Mom. It's like, everyone has different views. Thanks for saying I can talk to you. I might have some questions later.
Parent: I'm glad you feel comfortable coming to me with questions. It's true that everyone has different views on virginity, and it's perfectly okay to figure out what it means to you personally. Remember, what's important is that you make decisions that you're comfortable with and that you treat yourself and others with respect. Whenever you're ready to chat more or if something's on your mind, I'm here for you.
Child: Okay, cool. I guess I'll think more about what it means to me. Thanks, Mom.",,,"Parent: Hey buddy, I wanted to chat with you about something important—virginity. It's a term you might hear a lot about, but it’s more about your personal choice and readiness to be intimate with someone. What's most important is that you feel comfortable and understand the responsibilities and emotions involved. If you have any questions or just want to talk more about it, I'm here for you, okay?
Child: Okay, thanks for telling me, Mom. I’ve heard about it a bit, but I’m not really sure what it all means yet. Can we talk more about it later?
Parent: Of course, we can definitely talk more about it later. Whenever you're ready or have questions, just let me know. It's really important to have these conversations, and I'm glad you're open to it. Remember, it's all about making choices that feel right for you.
Child: Sure, Mom. I’ll let you know when I wanna talk more. Thanks for being cool about it.",,,"Parent: Hey buddy, I wanted to have a quick chat with you about something important. You might hear the word ""virginity"" at some point, and I just want you to know it's okay to ask me questions if you're curious. Virginity is a term people use to talk about whether someone has had sex for the first time. It's a personal decision and something people think about differently. I know this stuff can feel a bit awkward, but I'm always here if you want to talk or if you have any questions. It's important to understand these things as you grow up.
Child: Um, okay. Thanks for telling me, Mom. I guess if I have questions, I'll ask.
Parent: Of course, anytime you have questions, it's okay to ask. It's all part of growing up and learning. You know, everyone thinks about these things differently, and it's totally normal to feel unsure or curious. Just remember, I'm here whenever you want to chat or if something's on your mind. It's important to know you're never alone in figuring this stuff out.
Child: Okay, Mom. I get it. I'll let you know if I think of anything. Thanks for talking to me about it.
Parent: Sure thing, honey. Just remember, there's no rush to understand everything at once. It's okay to take your time and ask questions whenever you're ready. Growing up is all about learning, and I'm here to help with anything you need.
Child: Alright, I'll keep that in mind. Thanks, Mom.","{'age': {'value': '13', 'definition': 'Chronological age of child used as an indicator of pubertal status and readiness for conversations of different depth (more depth as child gets older) and breadth (more breadth as child gets older)'}, 'embarrassment_level': {'value': 'low', 'definition': 'Degree of child’s discomfort or unease about conversations surrounding sexuality that may prevent open dialogue'}, 'parent_child_closeness_level': {'value': 'medium', 'definition': 'Degree of closeness and comfort with parent.'}, 'gender': {'value': 'male', 'definition': ""The child's gender identity.""}}","{'confidence_level': {'value': 'medium', 'definition': 'Degree of self-efficacy (i.e., confidence) in ability to effectively communicate with the child.'}, 'comfort_level': {'value': 'medium', 'definition': 'Degree of parent’s comfort or ease about conversations surrounding sexuality.'}, 'open_dialogue': {'value': 'high', 'definition': 'Degree to which parent engages in a direct and positive dialogue, as opposed to a closed and one-sided lecture'}, 'role': {'value': 'mother', 'definition': ""The parent's gender and role in the family.""}}","Parent: Hey buddy, I wanted to talk to you about something important – virginity and how it’s viewed. Some people make a big deal out of it, but it’s really about what feels right for you. It’s important to be safe and responsible whenever you decide to have sex, so always use protection like condoms. Remember, it’s your choice, and there’s no rush. You can always talk to me if you have questions or need advice.
Child: Okay, Mom. Thanks for telling me. I'll let you know if I have questions.",,,"Parent: Hey buddy, I wanted to talk to you about something important. You know, as you grow up, you'll hear people talk about virginity and what it means. Some people think it's a big deal, and others don't see it the same way. The most important thing is that you feel comfortable with your decisions and understand that it's okay to have your own views about it. If you ever have questions or just want to chat about this or anything else, I'm here to listen and help.
Child: Um, okay, Mom. I guess it's kinda confusing. I'll ask if I get curious, but thanks for saying it's okay to have my own thoughts about it.
Parent: I understand it can be confusing, and that's okay, buddy. Remember, what's most important is that you feel comfortable and make choices that are right for you. We can always talk more about this, or any other questions you might have, whenever you feel like it. I'm here for you.
Child: Thanks, Mom. I'll keep that in mind. It's kinda a lot to think about right now, but I'm glad we can talk about it if I need to.
Parent: I'm glad you're open to talking about these things, and I know it's a lot to think about right now. Just remember, everyone has their own journey and there's no rush to figure everything out. It's perfectly okay to have your own thoughts and feelings about things like virginity, and it's important to respect those. Whenever you're ready or have questions, we'll talk through them together.
Child: Thanks, Mom. I'll think about it and let you know if I wanna talk more.","{'age': {'value': '13', 'definition': 'Chronological age of child used as an indicator of pubertal status and readiness for conversations of different depth (more depth as child gets older) and breadth (more breadth as child gets older)'}, 'embarrassment_level': {'value': 'low', 'definition': 'Degree of child’s discomfort or unease about conversations surrounding sexuality that may prevent open dialogue'}, 'parent_child_closeness_level': {'value': 'medium', 'definition': 'Degree of closeness and comfort with parent.'}, 'gender': {'value': 'male', 'definition': ""The child's gender identity.""}}","{'confidence_level': {'value': 'medium', 'definition': 'Degree of self-efficacy (i.e., confidence) in ability to effectively communicate with the child.'}, 'comfort_level': {'value': 'medium', 'definition': 'Degree of parent’s comfort or ease about conversations surrounding sexuality.'}, 'open_dialogue': {'value': 'high', 'definition': 'Degree to which parent engages in a direct and positive dialogue, as opposed to a closed and one-sided lecture'}, 'role': {'value': 'mother', 'definition': ""The parent's gender and role in the family.""}}","Parent: Hey buddy, I wanted to talk to you about something important. You might have heard the word ""virginity"" before, and I just wanted to make sure you understand what it means. Virginity is a term people use when talking about whether someone has had sex before. It's okay if you're curious or have questions about it. Just know that it's a topic that's different for everyone, and it's okay to take your time to understand it as you grow up. If you ever have any questions or want to talk more about it, I'm here to chat, okay?
Child: Um, okay. Thanks for telling me, Mom. I don't really have questions right now, but I guess I'll let you know if I do.","{'age': {'value': '13', 'definition': 'Chronological age of child used as an indicator of pubertal status and readiness for conversations of different depth (more depth as child gets older) and breadth (more breadth as child gets older)'}, 'embarrassment_level': {'value': 'low', 'definition': 'Degree of child’s discomfort or unease about conversations surrounding sexuality that may prevent open dialogue'}, 'parent_child_closeness_level': {'value': 'medium', 'definition': 'Degree of closeness and comfort with parent.'}, 'gender': {'value': 'male', 'definition': ""The child's gender identity.""}}","{'confidence_level': {'value': 'medium', 'definition': 'Degree of self-efficacy (i.e., confidence) in ability to effectively communicate with the child.'}, 'comfort_level': {'value': 'medium', 'definition': 'Degree of parent’s comfort or ease about conversations surrounding sexuality.'}, 'open_dialogue': {'value': 'high', 'definition': 'Degree to which parent engages in a direct and positive dialogue, as opposed to a closed and one-sided lecture'}, 'role': {'value': 'mother', 'definition': ""The parent's gender and role in the family.""}}","Parent: Hey buddy, I wanted to talk to you about something important. You might have heard the term ""virginity"" before. It's something that people often talk about when they start learning about sex. Virginity is just a concept, and different people see it in different ways. Some people think it's very important, while others don't think it matters as much. What's important is understanding what feels right for you and making sure you're safe and comfortable when you decide to be intimate with someone. If you ever have questions or want to talk more about this, I'm here for you, okay?
Child: Uh, okay, Mom. I think I kinda get it. Thanks for telling me. I'll let you know if I have any questions.","{'age': {'value': '13', 'definition': 'Chronological age of child used as an indicator of pubertal status and readiness for conversations of different depth (more depth as child gets older) and breadth (more breadth as child gets older)'}, 'embarrassment_level': {'value': 'low', 'definition': 'Degree of child’s discomfort or unease about conversations surrounding sexuality that may prevent open dialogue'}, 'parent_child_closeness_level': {'value': 'medium', 'definition': 'Degree of closeness and comfort with parent.'}, 'gender': {'value': 'male', 'definition': ""The child's gender identity.""}}","{'confidence_level': {'value': 'medium', 'definition': 'Degree of self-efficacy (i.e., confidence) in ability to effectively communicate with the child.'}, 'comfort_level': {'value': 'medium', 'definition': 'Degree of parent’s comfort or ease about conversations surrounding sexuality.'}, 'open_dialogue': {'value': 'high', 'definition': 'Degree to which parent engages in a direct and positive dialogue, as opposed to a closed and one-sided lecture'}, 'role': {'value': 'mother', 'definition': ""The parent's gender and role in the family.""}}"
2,"Parent: Hey buddy, I wanted to have a chat about something important—virginity. It's a personal decision, and it's okay to have questions or feel unsure. It's important to wait until you feel ready and to always be respectful of yourself and others. If you ever want to talk more about it or have questions, I'm here for you.
Child: Okay, thanks for telling me, Mom. I kinda get it, but if I have questions later, I'll ask.",,,"Parent: Hey buddy, I wanted to talk to you about something important—virginity. You might hear a lot about it and how it's a big deal, but I want you to know that everyone's view on it can be different. It's totally okay to not see it as the be-all and end-all. What’s really important is feeling ready and making sure it's a safe and respectful experience for you and the other person. Always prioritize using protection to stay safe. If you ever have questions or just want to chat about this stuff, I'm here for you.
Child: Okay, thanks for telling me, Mom. I'll let you know if I have questions. It's kinda confusing sometimes, but I get what you're saying about it being different for everyone.
Parent: I'm glad you get what I'm saying, and it's totally okay to find it confusing—it's a big topic! Just remember that it's perfectly fine to have your own views on it, and there's no rush to figure everything out. What's most important is that you feel comfortable and make choices that are right for you. Like I said, I'm always here to talk if you have more questions or need advice.
Child: Child: Thanks, Mom. I guess it’s just one of those things I’ll figure out as I go. I’ll definitely talk to you if I need to.",,,"Parent: Hey buddy, I wanted to talk to you about something important—virginity. It's a personal decision, and there's no rush. What's most important is that you feel ready and understand the responsibility that comes with it. If you have any questions or want to talk more about it, I'm here for you.
Child: Kid: Okay, thanks for telling me, Mom. I kinda get it, but maybe we can talk more about it later?
Parent: Of course, we can talk more about it whenever you're ready. It's a big topic, and I want you to feel comfortable asking anything. Just remember, it's all about making decisions that are right for you and respecting yourself and others. Let me know when you want to chat again, okay?
Child: Kid: Cool, thanks, Mom. I’ll let you know when I wanna talk more.",,,"Parent: Hey buddy, can we talk about something important for a minute? I know you might have heard the word ""virginity"" before. It's a word some people use to talk about whether someone has had sex or not. It's okay to be curious about it, and it's natural to have questions. If you ever want to talk more or have questions, I'm here to chat whenever you're ready.
Child: Um, okay, thanks for telling me. I don't really have questions right now, but I'll let you know if I do.","{'age': {'value': '13', 'definition': 'Chronological age of child used as an indicator of pubertal status and readiness for conversations of different depth (more depth as child gets older) and breadth (more breadth as child gets older)'}, 'embarrassment_level': {'value': 'low', 'definition': 'Degree of child’s discomfort or unease about conversations surrounding sexuality that may prevent open dialogue'}, 'parent_child_closeness_level': {'value': 'medium', 'definition': 'Degree of closeness and comfort with parent.'}, 'gender': {'value': 'male', 'definition': ""The child's gender identity.""}}","{'confidence_level': {'value': 'medium', 'definition': 'Degree of self-efficacy (i.e., confidence) in ability to effectively communicate with the child.'}, 'comfort_level': {'value': 'medium', 'definition': 'Degree of parent’s comfort or ease about conversations surrounding sexuality.'}, 'open_dialogue': {'value': 'high', 'definition': 'Degree to which parent engages in a direct and positive dialogue, as opposed to a closed and one-sided lecture'}, 'role': {'value': 'mother', 'definition': ""The parent's gender and role in the family.""}}","Parent: Hey buddy, I wanted to chat with you about something important—virginity. There’s a lot of talk about it and it can be a big deal for some, but it’s really up to you how you view it. It's important to understand that everyone feels differently about it. Some people want their first time to be with someone special, while others might feel differently and that's okay too. What's most important is that you feel comfortable and make decisions that are right for you. If you ever have questions or want to talk more about this, I'm always here for you.
Child: Child: Okay, I get it. Thanks for talking to me about it, Mom. I’ll let you know if I have any questions.",,,"Parent: Hey buddy, I wanted to talk to you about something that's important as you grow up—it's about understanding our bodies and things like virginity. Virginity is often talked about as a big deal, but it's really just about when someone chooses to start having sex. It's important to know that everyone thinks about it differently, and that's okay. The main thing is to make sure you're ready and that it's your choice, not because of what others might say. If you ever have questions or just want to chat more, I'm here for you, okay?
Child: Okay, Mom. Thanks for telling me. I might have questions later, but I'm good for now.","{'age': {'value': '13', 'definition': 'Chronological age of child used as an indicator of pubertal status and readiness for conversations of different depth (more depth as child gets older) and breadth (more breadth as child gets older)'}, 'embarrassment_level': {'value': 'low', 'definition': 'Degree of child’s discomfort or unease about conversations surrounding sexuality that may prevent open dialogue'}, 'parent_child_closeness_level': {'value': 'medium', 'definition': 'Degree of closeness and comfort with parent.'}, 'gender': {'value': 'male', 'definition': ""The child's gender identity.""}}","{'confidence_level': {'value': 'medium', 'definition': 'Degree of self-efficacy (i.e., confidence) in ability to effectively communicate with the child.'}, 'comfort_level': {'value': 'medium', 'definition': 'Degree of parent’s comfort or ease about conversations surrounding sexuality.'}, 'open_dialogue': {'value': 'high', 'definition': 'Degree to which parent engages in a direct and positive dialogue, as opposed to a closed and one-sided lecture'}, 'role': {'value': 'mother', 'definition': ""The parent's gender and role in the family.""}}","Parent: Hey buddy, I wanted to talk to you about something important. You might hear the word ""virginity"" from friends or on TV, and it's okay not to know exactly what it means. It's about when someone decides to have sex for the first time. But what's really important is making sure you feel ready and comfortable when you're older. Right now, if you ever have questions or feel curious about things you hear, you can always come to me, and we can chat about it together, okay?
Child: Um, okay, thanks for telling me. I guess I'll ask if I ever have questions.
Parent: I'm really glad you're open to asking questions when you're curious, buddy. It's important to me that you feel comfortable talking about this stuff. Remember, there's no rush to know everything right now. Just know I'm here when you need me, okay?
Child: Okay, got it. I'll let you know if I get curious or anything. Thanks, Mom.","{'age': {'value': '13', 'definition': 'Chronological age of child used as an indicator of pubertal status and readiness for conversations of different depth (more depth as child gets older) and breadth (more breadth as child gets older)'}, 'embarrassment_level': {'value': 'low', 'definition': 'Degree of child’s discomfort or unease about conversations surrounding sexuality that may prevent open dialogue'}, 'parent_child_closeness_level': {'value': 'medium', 'definition': 'Degree of closeness and comfort with parent.'}, 'gender': {'value': 'male', 'definition': ""The child's gender identity.""}}","{'confidence_level': {'value': 'medium', 'definition': 'Degree of self-efficacy (i.e., confidence) in ability to effectively communicate with the child.'}, 'comfort_level': {'value': 'medium', 'definition': 'Degree of parent’s comfort or ease about conversations surrounding sexuality.'}, 'open_dialogue': {'value': 'high', 'definition': 'Degree to which parent engages in a direct and positive dialogue, as opposed to a closed and one-sided lecture'}, 'role': {'value': 'mother', 'definition': ""The parent's gender and role in the family.""}}","Parent: Hey buddy, I know you might hear a lot of different things about virginity and what it means. It's important to remember that everyone can have their own thoughts on it, and that's okay. What's most important is understanding that you should always make choices that feel right for you, respect others, and practice safe habits when you're older. If you ever have questions or feel confused, you can always come to me, okay?
Child: Uh, okay. I guess it's kinda confusing 'cause everyone says different stuff about it. But thanks for saying I can talk to you about it. I'll let you know if I wanna know more or something.","{'age': {'value': '13', 'definition': 'Chronological age of child used as an indicator of pubertal status and readiness for conversations of different depth (more depth as child gets older) and breadth (more breadth as child gets older)'}, 'embarrassment_level': {'value': 'low', 'definition': 'Degree of child’s discomfort or unease about conversations surrounding sexuality that may prevent open dialogue'}, 'parent_child_closeness_level': {'value': 'medium', 'definition': 'Degree of closeness and comfort with parent.'}, 'gender': {'value': 'male', 'definition': ""The child's gender identity.""}}","{'confidence_level': {'value': 'medium', 'definition': 'Degree of self-efficacy (i.e., confidence) in ability to effectively communicate with the child.'}, 'comfort_level': {'value': 'medium', 'definition': 'Degree of parent’s comfort or ease about conversations surrounding sexuality.'}, 'open_dialogue': {'value': 'high', 'definition': 'Degree to which parent engages in a direct and positive dialogue, as opposed to a closed and one-sided lecture'}, 'role': {'value': 'mother', 'definition': ""The parent's gender and role in the family.""}}"
