7,"Parent: Hey buddy, I wanted to talk to you about something important—virginity. It’s a personal choice and different for everyone, but what matters most is that you feel ready and comfortable whenever you decide to be intimate with someone. If you have any questions or need to talk about anything, I’m always here for you.
Child: Child: Okay, thanks, Mom. I get it. If I have questions, I’ll let you know.",,,"Parent: Hey bud, I wanted to talk to you about something important—virginity. It's often talked about like it's a big deal, but it’s really just one part of your personal journey. What matters most is that you feel comfortable and safe when you decide to become sexually active. Always make sure you’re being responsible, like using protection to prevent STDs and unwanted pregnancies. Remember, it’s your choice and there's no right or wrong way to go about it; just make sure it's on your terms. If you have any questions or need to talk, I'm here for you.
Child: Okay, thanks for telling me, Mom. I get what you're saying. If I have questions, I'll let you know.",,,"Parent: Hey bud, I wanted to chat with you about something important. You might have heard the term ""virginity"" before. It's often used to describe the first time someone has sex. It's a personal decision and there's no rush to do anything you're not ready for. It's important to make choices based on what feels right for you and to respect both your own feelings and those of your partner. If you have any questions or want to talk about anything, I'm always here to chat.
Child: Okay, thanks for telling me, Mom. I don't really have questions right now, but I'll ask if I do.",,,"Parent: Hey buddy, I wanted to chat with you about something important today. Have you ever heard the word ""virginity""? It's a term some people use to talk about when someone hasn't had sex yet. It's totally okay if you have questions or if you're not sure what that means. Just know that these kinds of things are really personal and everyone thinks about them differently. If you ever want to talk more about it or anything else, I'm always here to listen, okay?
Child: Um, okay, thanks for telling me. I guess I kinda heard the word before. It's cool that I can ask you stuff.
Parent: Sure, I'm glad you feel comfortable asking me stuff. Virginity is one of those things that people can have different opinions about. It's not something you need to worry about right now, but it's good to know you can always come to me with questions. Whenever you hear words like that and you're curious, just let me know, okay?
Child: Yeah, okay, Mom. Thanks for letting me know I can ask you stuff. I'll think about it, and if I have questions, I'll tell you.","{'age': {'value': '13', 'definition': 'Chronological age of child used as an indicator of pubertal status and readiness for conversations of different depth (more depth as child gets older) and breadth (more breadth as child gets older)'}, 'embarrassment_level': {'value': 'low', 'definition': 'Degree of child’s discomfort or unease about conversations surrounding sexuality that may prevent open dialogue'}, 'parent_child_closeness_level': {'value': 'medium', 'definition': 'Degree of closeness and comfort with parent.'}, 'gender': {'value': 'male', 'definition': ""The child's gender identity.""}}","{'confidence_level': {'value': 'medium', 'definition': 'Degree of self-efficacy (i.e., confidence) in ability to effectively communicate with the child.'}, 'comfort_level': {'value': 'medium', 'definition': 'Degree of parent’s comfort or ease about conversations surrounding sexuality.'}, 'open_dialogue': {'value': 'high', 'definition': 'Degree to which parent engages in a direct and positive dialogue, as opposed to a closed and one-sided lecture'}, 'role': {'value': 'mother', 'definition': ""The parent's gender and role in the family.""}}","Parent: Hey buddy, can we chat for a minute? I wanted to talk about something important—virginity. You might hear a lot of different things about it from friends or online, but it's really a personal thing. Some people see it as a big milestone, while others don't think it's such a big deal. What's most important is how you feel about it and making sure you're comfortable with your decisions. It's okay to take your time and think about what it means to you. If you ever have questions or just want to talk, I'm here for you.
Child: Child: Okay, Mom. I guess I've heard some stuff about it, but it's kinda confusing. Can we maybe talk more about what it means later?
Parent: Of course, we can talk more about it later, whenever you're ready. Just remember, there's no rush to figure everything out right now. It's all about what feels right for you, and there's no pressure to make any decisions until you're comfortable. I'm here whenever you want to chat, okay?
Child: Okay, cool, Mom. Thanks for saying that. I'll let you know when I wanna talk more.",,,"Parent: Hey buddy, I wanted to talk to you about something important. You know how sometimes people talk about virginity? It's a word you might hear as you grow up. Some people think it's a really big deal and have different ideas about it. But what's most important is how you feel about these things and making sure you're comfortable and safe. If you ever have questions or just want to talk about this stuff, I'm always here, okay?
Child: Um, okay, thanks for telling me, Mom. I don't really know a lot about it yet, but I'll ask if I get confused or something.
Parent: I'm glad you feel comfortable asking questions if you get confused. Virginity is just one part of growing up that people have different ideas about. What's really important is understanding what feels right for you and respecting others' choices too. If you ever have questions or hear things that you're curious about, just remember I'm here to help you figure it out together, okay?
Child: Okay, Mom. I guess it sounds kinda important, but I’m not too sure what it all means yet. I'll let you know if I hear stuff or have questions, though.
Parent: You know, it's okay not to know everything right now. Virginity is just one idea that people have about growing up and making choices. What's most important is understanding your own feelings and being respectful of others. When you're older, you'll have more information and be able to make decisions that feel right for you. If you ever want to talk about it more or hear something you're curious about, I'm always here to chat, no pressure.
Child: Thanks, Mom. I guess I'll just keep it in mind and come to you if I need to chat about it more.","{'age': {'value': '13', 'definition': 'Chronological age of child used as an indicator of pubertal status and readiness for conversations of different depth (more depth as child gets older) and breadth (more breadth as child gets older)'}, 'embarrassment_level': {'value': 'low', 'definition': 'Degree of child’s discomfort or unease about conversations surrounding sexuality that may prevent open dialogue'}, 'parent_child_closeness_level': {'value': 'medium', 'definition': 'Degree of closeness and comfort with parent.'}, 'gender': {'value': 'male', 'definition': ""The child's gender identity.""}}","{'confidence_level': {'value': 'medium', 'definition': 'Degree of self-efficacy (i.e., confidence) in ability to effectively communicate with the child.'}, 'comfort_level': {'value': 'medium', 'definition': 'Degree of parent’s comfort or ease about conversations surrounding sexuality.'}, 'open_dialogue': {'value': 'high', 'definition': 'Degree to which parent engages in a direct and positive dialogue, as opposed to a closed and one-sided lecture'}, 'role': {'value': 'mother', 'definition': ""The parent's gender and role in the family.""}}","Parent: Hey buddy, I wanted to chat with you about something called virginity. It’s a term people use to talk about whether someone has had sex yet. You’re still young, but I want you to know it’s okay to have questions about this stuff. Everyone learns at their own pace, and you can always talk to me if you're curious or if friends bring it up. Remember, it's important to make choices that feel right for you when you're older.
Child: Okay, thanks for telling me, Mom. If I have questions, I’ll ask you.","{'age': {'value': '13', 'definition': 'Chronological age of child used as an indicator of pubertal status and readiness for conversations of different depth (more depth as child gets older) and breadth (more breadth as child gets older)'}, 'embarrassment_level': {'value': 'low', 'definition': 'Degree of child’s discomfort or unease about conversations surrounding sexuality that may prevent open dialogue'}, 'parent_child_closeness_level': {'value': 'medium', 'definition': 'Degree of closeness and comfort with parent.'}, 'gender': {'value': 'male', 'definition': ""The child's gender identity.""}}","{'confidence_level': {'value': 'medium', 'definition': 'Degree of self-efficacy (i.e., confidence) in ability to effectively communicate with the child.'}, 'comfort_level': {'value': 'medium', 'definition': 'Degree of parent’s comfort or ease about conversations surrounding sexuality.'}, 'open_dialogue': {'value': 'high', 'definition': 'Degree to which parent engages in a direct and positive dialogue, as opposed to a closed and one-sided lecture'}, 'role': {'value': 'mother', 'definition': ""The parent's gender and role in the family.""}}","Parent: Hey buddy, I wanted to talk to you about something called virginity. It's a word you might hear as you grow up, and it’s about when someone decides to have their first sexual experience. It's important to know that this is really personal and everyone feels differently about it. Some people think it's a big deal, and others don't. What's most important is that whenever you're ready, you feel comfortable and make choices that are right for you. If you ever have questions or want to talk more about this or anything else, I'm always here to listen and help.
Child: Um, okay. I guess I’ve heard about it a bit but didn’t really know what it meant. Thanks for explaining, Mom. I might have questions later, but I’m good for now.","{'age': {'value': '13', 'definition': 'Chronological age of child used as an indicator of pubertal status and readiness for conversations of different depth (more depth as child gets older) and breadth (more breadth as child gets older)'}, 'embarrassment_level': {'value': 'low', 'definition': 'Degree of child’s discomfort or unease about conversations surrounding sexuality that may prevent open dialogue'}, 'parent_child_closeness_level': {'value': 'medium', 'definition': 'Degree of closeness and comfort with parent.'}, 'gender': {'value': 'male', 'definition': ""The child's gender identity.""}}","{'confidence_level': {'value': 'medium', 'definition': 'Degree of self-efficacy (i.e., confidence) in ability to effectively communicate with the child.'}, 'comfort_level': {'value': 'medium', 'definition': 'Degree of parent’s comfort or ease about conversations surrounding sexuality.'}, 'open_dialogue': {'value': 'high', 'definition': 'Degree to which parent engages in a direct and positive dialogue, as opposed to a closed and one-sided lecture'}, 'role': {'value': 'mother', 'definition': ""The parent's gender and role in the family.""}}"
8,"Parent: Hey buddy, I wanted to have a quick chat about something important. You might hear a lot of different things about virginity and what it means. It's just a term people use to talk about the first time they have sex. What's really important is making sure that whenever you're ready, it's with someone you care about, and that you both feel comfortable and safe. If you have any questions or want to talk more about it, I'm here for you.
Child: Okay, thanks for telling me, Mom. I think I get it. I'll let you know if I have any questions later.",,,"Parent: Hey buddy, I wanted to have a quick chat about something important—virginity. You might hear different things from friends or online, but it's really a personal thing. Some people might think it's a big deal, while others might not. What's most important is how you feel about it. Just remember, there's no rush, and it's okay to wait until you're ready. If you ever have questions or want to talk more, I'm here for you, okay?
Child: Okay, thanks for telling me, Mom. I guess I'll think about it more when I need to. If I have questions, I'll ask.",,,"Parent: Hey buddy, I wanted to have a quick chat with you about something important. You might hear a lot of different things about virginity, but what matters most is understanding that it's okay to wait until you feel ready to have sex. It's a personal choice, and there's no pressure to rush into anything. If you ever have questions or just want to talk about this stuff, I'm here for you.
Child: Teen: Okay, thanks for telling me, Mom. It's kinda confusing sometimes, so it's good to know I can talk to you.
Parent: Of course, it's normal to feel confused about it. Just remember, virginity is more about what it means to you personally rather than what others might say. It's perfectly okay to take your time and figure out your own values and feelings. If you have any questions or if there's anything specific you'd like to know or talk about, I'm always here to help.
Child: Teen: Thanks, Mom. It's nice to know I can ask stuff. I'll definitely come to you if I have questions.
Parent: I'm really glad to hear that. Just remember, it's important to make decisions about sex based on your own feelings and comfort level, not because you feel pressured by anyone else. Everyone's journey is different, and it's okay to take things at your own pace. If you ever need advice or just someone to listen, I'm always here for you.
Child: Teen: Got it, Mom. Thanks for being open about it. I'll let you know if I wanna chat more.",,,"Parent: Hey buddy, I wanted to have a quick chat with you about something called virginity. It's a word you might hear as you get older, and it usually means whether someone has had sex or not. It's not something you need to worry about right now, but it's good to understand that everyone has their own time for these things, and it's important to respect that. If you ever have any questions or hear things that confuse you, I'm always here to talk, okay?
Child: Uh, okay. Thanks for telling me, Mom. If I have questions, I'll ask.","{'age': {'value': '13', 'definition': 'Chronological age of child used as an indicator of pubertal status and readiness for conversations of different depth (more depth as child gets older) and breadth (more breadth as child gets older)'}, 'embarrassment_level': {'value': 'low', 'definition': 'Degree of child’s discomfort or unease about conversations surrounding sexuality that may prevent open dialogue'}, 'parent_child_closeness_level': {'value': 'medium', 'definition': 'Degree of closeness and comfort with parent.'}, 'gender': {'value': 'male', 'definition': ""The child's gender identity.""}}","{'confidence_level': {'value': 'medium', 'definition': 'Degree of self-efficacy (i.e., confidence) in ability to effectively communicate with the child.'}, 'comfort_level': {'value': 'medium', 'definition': 'Degree of parent’s comfort or ease about conversations surrounding sexuality.'}, 'open_dialogue': {'value': 'high', 'definition': 'Degree to which parent engages in a direct and positive dialogue, as opposed to a closed and one-sided lecture'}, 'role': {'value': 'mother', 'definition': ""The parent's gender and role in the family.""}}","Parent: Hey buddy, I wanted to talk to you about something that's often talked about but can be misunderstood—virginity. It's a concept that society sometimes gives a lot of weight to, but it's important to know that everyone's view on it can be different. What really matters is how you feel about it and making sure any decisions you make are right for you. It's okay to have your own beliefs and feelings about it, and to talk about those if you ever want to. Remember, I'm always here to chat if you have any questions or want to discuss anything further.
Child: Okay, thanks for telling me, Mom. I get that it's not the same for everyone. I'll let you know if I ever wanna talk more about it.",,,"Parent: Hey buddy, I wanted to talk to you about something important today. You might hear people talk about virginity, and it's often made out to be a really big deal. But it's okay to have different thoughts about it. Virginity is a personal thing, and what's most important is understanding your own feelings about it and respecting others' views. If you ever have questions or feel confused, you can always talk to me, okay?
Child: Uh, okay. Thanks for telling me, Mom. I guess I'll let you know if I have questions.
Parent: You know, it's okay to feel a bit unsure about these things, and I'm really glad you're open to talking with me. Virginity can seem like a big deal because of what we hear around us, but remember, it's about what feels right for you. It's important to be respectful and thoughtful about these topics. If you have any questions, no matter how small, just let me know, okay? I'm here to help you figure things out.
Child: Okay, Mom. I get it. It’s kinda confusing, but I’ll tell you if I wanna know more. Thanks for being there.
Parent: I'm really glad you feel comfortable talking to me about this. It's okay if it feels confusing now; you're still growing and learning. What's important is knowing that you can always ask questions when you're ready. Just remember, there's no rush to understand everything right away. Everyone has their own journey, and it's okay to take your time with it.
Child: Yeah, I get it, Mom. It’s kinda weird to think about, but thanks for saying I can ask stuff. I'll let you know if I need to.
Parent: You know, it's perfectly normal for things like this to feel a bit weird or confusing, especially at your age. Just remember, virginity is a personal thing, and everyone has their own feelings about it. What's important is that you feel comfortable with your own thoughts and decisions when the time comes. And you can always come to me with questions or if you want to talk about it more. I'm here to support you, no matter what.
Child: Child: Yeah, it’s a bit weird, but I’ll ask if I’m curious. Thanks, Mom.
Parent: I'm really glad you're open to asking questions, even if it feels a bit weird right now. Just remember, understanding these things takes time, and there's no rush. Virginity is a personal topic, and people have different views on it, which is okay. What's important is that you make choices that are right for you when the time comes. Whenever you feel curious or confused, I'm here to talk about it.
Child: Child: Yeah, I get it, it's different for everyone. I'll ask if I wanna know more. Thanks, Mom.","{'age': {'value': '13', 'definition': 'Chronological age of child used as an indicator of pubertal status and readiness for conversations of different depth (more depth as child gets older) and breadth (more breadth as child gets older)'}, 'embarrassment_level': {'value': 'low', 'definition': 'Degree of child’s discomfort or unease about conversations surrounding sexuality that may prevent open dialogue'}, 'parent_child_closeness_level': {'value': 'medium', 'definition': 'Degree of closeness and comfort with parent.'}, 'gender': {'value': 'male', 'definition': ""The child's gender identity.""}}","{'confidence_level': {'value': 'medium', 'definition': 'Degree of self-efficacy (i.e., confidence) in ability to effectively communicate with the child.'}, 'comfort_level': {'value': 'medium', 'definition': 'Degree of parent’s comfort or ease about conversations surrounding sexuality.'}, 'open_dialogue': {'value': 'high', 'definition': 'Degree to which parent engages in a direct and positive dialogue, as opposed to a closed and one-sided lecture'}, 'role': {'value': 'mother', 'definition': ""The parent's gender and role in the family.""}}","Parent: Hey buddy, I wanted to have a quick chat with you about something that's important as you grow up. It's called virginity, which means whether someone has had sex or not. It's okay if you don't know much about it yet, and it's normal to feel a bit shy talking about these things. I just want you to know that it's perfectly fine to ask questions whenever you're curious, and we can talk about anything. I'm here to help you understand things as you grow older.
Child: Um, okay, thanks for telling me, Mom. I don't really have any questions right now, but I'll let you know if I do later.
Parent: Thanks for letting me know, and remember, you can ask me anything, anytime. Virginity is just one of those things that people talk about, but what's most important is understanding it in a way that makes sense to you. We can discuss more as you get older, and if you ever hear something from friends or on TV that you're unsure about, just come to me, okay? I'm always here to help.
Child: Okay, Mom. I'll remember that. Thanks for being there for me.","{'age': {'value': '13', 'definition': 'Chronological age of child used as an indicator of pubertal status and readiness for conversations of different depth (more depth as child gets older) and breadth (more breadth as child gets older)'}, 'embarrassment_level': {'value': 'low', 'definition': 'Degree of child’s discomfort or unease about conversations surrounding sexuality that may prevent open dialogue'}, 'parent_child_closeness_level': {'value': 'medium', 'definition': 'Degree of closeness and comfort with parent.'}, 'gender': {'value': 'male', 'definition': ""The child's gender identity.""}}","{'confidence_level': {'value': 'medium', 'definition': 'Degree of self-efficacy (i.e., confidence) in ability to effectively communicate with the child.'}, 'comfort_level': {'value': 'medium', 'definition': 'Degree of parent’s comfort or ease about conversations surrounding sexuality.'}, 'open_dialogue': {'value': 'high', 'definition': 'Degree to which parent engages in a direct and positive dialogue, as opposed to a closed and one-sided lecture'}, 'role': {'value': 'mother', 'definition': ""The parent's gender and role in the family.""}}","Parent: Hey buddy, I wanted to chat with you about something important. You might hear people talking about virginity and what it means. It's a personal choice and can mean different things to different people. What's important is making informed decisions about your body when you're older. Always keep in mind that you should feel comfortable and safe, and it's okay to ask questions when you're curious. I'm here to help whenever you want to talk.
Child: Uh, okay. Thanks, Mom. I don't really get it all yet, but I'll ask you if I have questions later.
Parent: Sure thing, sweetie. It's okay if you don't understand it all right now. Just remember, whenever you have questions, no matter how small they seem, I'm always here to help you figure things out. It's important to talk about these things so you feel ready and informed as you grow older.
Child: Okay, Mom. I'll let you know if I start wondering about it. Thanks.","{'age': {'value': '13', 'definition': 'Chronological age of child used as an indicator of pubertal status and readiness for conversations of different depth (more depth as child gets older) and breadth (more breadth as child gets older)'}, 'embarrassment_level': {'value': 'low', 'definition': 'Degree of child’s discomfort or unease about conversations surrounding sexuality that may prevent open dialogue'}, 'parent_child_closeness_level': {'value': 'medium', 'definition': 'Degree of closeness and comfort with parent.'}, 'gender': {'value': 'male', 'definition': ""The child's gender identity.""}}","{'confidence_level': {'value': 'medium', 'definition': 'Degree of self-efficacy (i.e., confidence) in ability to effectively communicate with the child.'}, 'comfort_level': {'value': 'medium', 'definition': 'Degree of parent’s comfort or ease about conversations surrounding sexuality.'}, 'open_dialogue': {'value': 'high', 'definition': 'Degree to which parent engages in a direct and positive dialogue, as opposed to a closed and one-sided lecture'}, 'role': {'value': 'mother', 'definition': ""The parent's gender and role in the family.""}}"
