3,"Parent: Hey buddy, I wanted to have a quick chat about something important—virginity and what it means. It's totally normal to have questions about it. Virginity is often talked about in different ways, but what's most important is making sure you're comfortable and informed. If you ever have any questions or need advice, I'm here for you. It's okay to wait until you're ready and to approach things in a way that feels right for you. Always remember, it's about mutual respect and understanding in any relationship.
Child: Kid: Thanks, Mom. I get it. If I have questions, I'll ask. It's good to know you're here to talk.",,,"Parent: Hey buddy, I wanted to have a chat about something important—virginity. You know, people have different views on it, and that's okay. Some see it as a big deal, while others don't. What's important is understanding your own feelings about it and making choices that are right for you. It's perfectly normal to feel unsure, so if you ever have questions or just want to talk, I'm here for you.
Child: Okay, mom. I get it. I think it's cool to know that people see it differently. If I have questions, I'll ask you. Thanks for being open about it.",,,"Parent: Hey buddy, I wanted to talk to you about something important. You might hear a lot about virginity and what it means, but I want you to know that it's okay to have questions or feel confused. Virginity is often talked about in different ways, but what's most important is that you understand your own values and feel comfortable making choices that are right for you. If you ever want to talk about this or have any questions, I'm here for you.
Child: Child: Okay, thanks, Mom. I guess I have heard stuff, but I don't really get why it matters so much. It's kinda confusing. Can we talk more about it later?
Parent: Of course, we can talk more about it whenever you're ready. It's okay to be confused because it's a complicated topic. Just remember that what's most important is being respectful to yourself and others and making decisions that feel right for you. Let me know when you want to chat, okay?
Child: Alright, cool. I'll think about it and let you know when I wanna talk more. Thanks for being chill about it, Mom.",,,"Parent: Hey buddy, can we talk for a sec? I know some of this stuff can feel a bit awkward, but it's important. I want you to know that virginity is just a word people use to talk about whether someone has had sex. It's okay to have questions, and I'm here to help with any that you might have. You can always talk to me about anything, no matter how awkward it might seem.
Child: Um, okay. So, like, why do people care so much about it?
Parent: Well, that's a really good question. People care about it for different reasons. Some see it as a personal milestone, others might have cultural or religious beliefs tied to it. It's important to remember that it's a personal thing, and what's most important is how you feel about it. It's okay to be curious, and you can always come to me with your questions.
Child: Okay, I think I get it. So, is it something I should be worried about now, or is it more for when I'm older?
Parent: Well, it's not something you need to worry about right now. It's more about when you're older and start to think about relationships in a different way. Right now, it's important to focus on being a kid, having fun, and learning about yourself. If you ever have questions or feel unsure about something, I'm always here to chat, okay?
Child: Okay, cool. Thanks, Mom. I'll let you know if I have more questions later.","{'age': {'value': '13', 'definition': 'Chronological age of child used as an indicator of pubertal status and readiness for conversations of different depth (more depth as child gets older) and breadth (more breadth as child gets older)'}, 'embarrassment_level': {'value': 'low', 'definition': 'Degree of child’s discomfort or unease about conversations surrounding sexuality that may prevent open dialogue'}, 'parent_child_closeness_level': {'value': 'medium', 'definition': 'Degree of closeness and comfort with parent.'}, 'gender': {'value': 'male', 'definition': ""The child's gender identity.""}}","{'confidence_level': {'value': 'medium', 'definition': 'Degree of self-efficacy (i.e., confidence) in ability to effectively communicate with the child.'}, 'comfort_level': {'value': 'medium', 'definition': 'Degree of parent’s comfort or ease about conversations surrounding sexuality.'}, 'open_dialogue': {'value': 'high', 'definition': 'Degree to which parent engages in a direct and positive dialogue, as opposed to a closed and one-sided lecture'}, 'role': {'value': 'mother', 'definition': ""The parent's gender and role in the family.""}}","Parent: Hey, I know this might feel a bit awkward, but I want to talk to you about something important—virginity. It's often seen as a big deal, but I want you to know that it's a personal thing and can mean different things to different people. There's no rush or pressure to have any particular experience, and what's important is that you feel comfortable and make decisions that are right for you. If you ever have questions or just want to chat about this stuff, I'm here for you.
Child: Okay, thanks for telling me, Mom. I get that it's personal. I'll let you know if I have questions.",,,"Parent: Hey buddy, I wanted to talk to you about something called virginity. It's a word people use to talk about the first time someone has sex. Everyone thinks about it differently. Some people see it as a big deal and others don't. It's important to know that it's up to each person to decide what it means to them. You can always ask me if you have questions or want to talk more about this or anything else, okay?
Child: Uh, okay. So, like, why do people think it's a big deal?
Parent: Well, some people think it's a big deal because society has made it into a kind of milestone, like a sign of growing up. For some cultures and families, it has special beliefs or traditions attached to it. It's important to remember that everyone is different, and what's important to one person might not be to another. What really matters is how you feel about it and making choices that are right for you. Do you have any other questions about this?
Child: So, like, do people have to decide right away what it means to them, or can they figure it out later?
Parent: You know, it's okay to take your time to figure out what virginity means to you. There's no rush, and it's something that can evolve as you grow and learn more about yourself and the world. It's important to make decisions that feel right for you when you're ready. If you ever want to talk more about this or anything else, I'm here for you.
Child: Child: Oh, okay. So, like, it's just something people think about differently? That's kinda cool, I guess. Thanks for telling me, Mom.","{'age': {'value': '13', 'definition': 'Chronological age of child used as an indicator of pubertal status and readiness for conversations of different depth (more depth as child gets older) and breadth (more breadth as child gets older)'}, 'embarrassment_level': {'value': 'low', 'definition': 'Degree of child’s discomfort or unease about conversations surrounding sexuality that may prevent open dialogue'}, 'parent_child_closeness_level': {'value': 'medium', 'definition': 'Degree of closeness and comfort with parent.'}, 'gender': {'value': 'male', 'definition': ""The child's gender identity.""}}","{'confidence_level': {'value': 'medium', 'definition': 'Degree of self-efficacy (i.e., confidence) in ability to effectively communicate with the child.'}, 'comfort_level': {'value': 'medium', 'definition': 'Degree of parent’s comfort or ease about conversations surrounding sexuality.'}, 'open_dialogue': {'value': 'high', 'definition': 'Degree to which parent engages in a direct and positive dialogue, as opposed to a closed and one-sided lecture'}, 'role': {'value': 'mother', 'definition': ""The parent's gender and role in the family.""}}","Parent: Hey buddy, I know this might feel a bit awkward, but I wanted to talk to you about something that's important as you grow up. Have you heard the term ""virginity"" before? It's something that people talk about when it comes to growing up and our bodies changing. If you have any questions or if anything's on your mind about it now or in the future, you can always come to me, and we can chat about it together.
Child: Um, yeah, I've heard of virginity before, but I'm not really sure what it all means. It's kinda weird to talk about, but I guess it's okay. What do you mean by it, though?
Parent: Well, it's great that you've heard of it, and I'm glad you're comfortable talking about it with me. Virginity is a word people often use to describe whether someone has had sexual intercourse for the first time. It's a personal and sometimes sensitive topic, and people have different feelings and beliefs about it. It's important to remember that it's okay to have questions and feelings about this stuff, and you can always ask me about anything that's on your mind. It's totally normal to be curious as you grow up.
Child: Okay, I think I get it a bit more now. It's like about growing up stuff. Thanks for explaining, Mom. If I get confused or curious, I'll ask you.","{'age': {'value': '13', 'definition': 'Chronological age of child used as an indicator of pubertal status and readiness for conversations of different depth (more depth as child gets older) and breadth (more breadth as child gets older)'}, 'embarrassment_level': {'value': 'low', 'definition': 'Degree of child’s discomfort or unease about conversations surrounding sexuality that may prevent open dialogue'}, 'parent_child_closeness_level': {'value': 'medium', 'definition': 'Degree of closeness and comfort with parent.'}, 'gender': {'value': 'male', 'definition': ""The child's gender identity.""}}","{'confidence_level': {'value': 'medium', 'definition': 'Degree of self-efficacy (i.e., confidence) in ability to effectively communicate with the child.'}, 'comfort_level': {'value': 'medium', 'definition': 'Degree of parent’s comfort or ease about conversations surrounding sexuality.'}, 'open_dialogue': {'value': 'high', 'definition': 'Degree to which parent engages in a direct and positive dialogue, as opposed to a closed and one-sided lecture'}, 'role': {'value': 'mother', 'definition': ""The parent's gender and role in the family.""}}","Parent: Hey buddy, I wanted to talk to you about something important today. You might hear the word ""virginity"" as you get older, and it's tied to when someone decides to have sex for the first time. People have different feelings about it, and it's okay to have your own thoughts too. What's most important is making choices that are right for you and respecting others' choices. If you ever have questions or want to talk more about it, I'm here to listen and help, okay?
Child: Um, okay, Mom. I think I get it. Thanks for telling me. I might ask about it later.
Parent: I'm glad you're open to talking about this, buddy. Remember, it's normal to have different feelings as you learn more about these things. And if you ever hear something that confuses you or makes you curious, you can always come to me. It's important to understand that everyone makes their own decisions about these things in their own time. What's most important is that you feel comfortable and make choices that are right for you.
Child: Okay, Mom. Thanks for explaining. If I get confused or curious, I'll ask you.
Parent: Of course, buddy. Just remember, it's okay to take your time learning about these things, and there's no rush. Everyone grows and understands things at their own pace. If you ever feel unsure or want to talk about anything, I'm always here to chat. It's all about what feels right for you.
Child: Okay, thanks, Mom. I appreciate it. I'll remember to ask if I have more questions later.","{'age': {'value': '13', 'definition': 'Chronological age of child used as an indicator of pubertal status and readiness for conversations of different depth (more depth as child gets older) and breadth (more breadth as child gets older)'}, 'embarrassment_level': {'value': 'low', 'definition': 'Degree of child’s discomfort or unease about conversations surrounding sexuality that may prevent open dialogue'}, 'parent_child_closeness_level': {'value': 'medium', 'definition': 'Degree of closeness and comfort with parent.'}, 'gender': {'value': 'male', 'definition': ""The child's gender identity.""}}","{'confidence_level': {'value': 'medium', 'definition': 'Degree of self-efficacy (i.e., confidence) in ability to effectively communicate with the child.'}, 'comfort_level': {'value': 'medium', 'definition': 'Degree of parent’s comfort or ease about conversations surrounding sexuality.'}, 'open_dialogue': {'value': 'high', 'definition': 'Degree to which parent engages in a direct and positive dialogue, as opposed to a closed and one-sided lecture'}, 'role': {'value': 'mother', 'definition': ""The parent's gender and role in the family.""}}"
4,"Parent: Hey buddy, I wanted to chat with you about something important. You might hear a lot about virginity and I just want you to know that it’s okay to have questions about it. Everyone's experience is different, and it's more about when you're ready and feeling comfortable and safe. If you ever have any questions or need to talk, I'm here for you.
Child: Teen: Uh, okay, thanks for telling me, Mom. I might have some questions later, but I'm good for now.
Parent: Of course, anytime you have questions or just want to talk, I'm here. Remember, there's no rush or pressure when it comes to things like virginity. It's all about what feels right for you. Just focus on making sure you're informed and comfortable with your decisions. We can chat more whenever you're ready.
Child: Teen: Okay, thanks, Mom. I appreciate it. I'll definitely let you know if I have any questions.",,,"Parent: Hey buddy, I wanted to talk to you about something important—virginity. It's a personal thing and everyone sees it differently. What's crucial is that you understand it's your choice and no one else's. When you decide to have sex, make sure it's for the right reasons and that you're prepared. Remember, being informed and safe is key, so always use protection to take care of your health. If you have any questions or need advice, I'm here for you.
Child: Okay, Mom. Thanks for telling me. I get that it's my choice. If I have questions, I'll ask you.",,,"Parent: Hey, I wanted to talk to you about something important—virginity. It’s a personal choice, and everyone’s experience is different. What matters most is that you feel ready and comfortable whenever you decide to take that step. If you’ve got questions or feelings about it, I’m here to listen and help.
Child: Teen: Yeah, I get it. Thanks for talking to me about it, Mom. I might have some questions later, but I’m good for now.",,,"Parent: Hey buddy, I wanted to chat with you for a bit about something called virginity. It's a topic you'll hear more about as you get older. Virginity is kind of like a term people use to talk about whether someone has had sex for the first time. It's important to know that it's a personal thing, and people might have different feelings or thoughts about it. If you ever have questions or want to talk more about it, I'm here for you. We can always talk about anything you're curious about.
Child: Um, okay. Thanks for telling me, Mom. I guess I don't have any questions right now, but I'll let you know if I do.","{'age': {'value': '13', 'definition': 'Chronological age of child used as an indicator of pubertal status and readiness for conversations of different depth (more depth as child gets older) and breadth (more breadth as child gets older)'}, 'embarrassment_level': {'value': 'low', 'definition': 'Degree of child’s discomfort or unease about conversations surrounding sexuality that may prevent open dialogue'}, 'parent_child_closeness_level': {'value': 'medium', 'definition': 'Degree of closeness and comfort with parent.'}, 'gender': {'value': 'male', 'definition': ""The child's gender identity.""}}","{'confidence_level': {'value': 'medium', 'definition': 'Degree of self-efficacy (i.e., confidence) in ability to effectively communicate with the child.'}, 'comfort_level': {'value': 'medium', 'definition': 'Degree of parent’s comfort or ease about conversations surrounding sexuality.'}, 'open_dialogue': {'value': 'high', 'definition': 'Degree to which parent engages in a direct and positive dialogue, as opposed to a closed and one-sided lecture'}, 'role': {'value': 'mother', 'definition': ""The parent's gender and role in the family.""}}","Parent: Hey, I wanted to talk to you about something important. You know, there's a lot of talk about virginity and what it means. Different people see it differently, and that's okay. What's important is understanding what feels right for you and making informed choices. It's crucial to respect yourself and others, and to ensure that any experiences you have are safe and consensual. If you ever have questions or just want to talk more about this, I'm here for you.
Child: Teen: Okay, thanks for talking to me about this. I get that it’s important to think about. I’ll let you know if I have any questions.",,,"Parent: Hey buddy, I thought it might be a good time to chat about some things you might hear about as you grow up, like the idea of virginity. It's a word that's often talked about, but what's important is understanding that everyone sees it differently. Some people think it's a really big deal, and for others, it might not be. What's most important is how you feel about it when the time comes. Remember, you can always come to me with any questions, no matter how silly or serious they seem.
Child: Um, okay, thanks for telling me, Mom. I've heard the word before, but I didn't really know what it meant. I'll let you know if I have any questions.
Parent: Sure thing, buddy. It's totally okay if you're not sure what it all means yet. Everyone learns about these things at their own pace. Just remember, what's important is that you feel comfortable and make decisions that are right for you. If you ever hear something that you're curious about or don't understand, you can always ask me or we can figure it out together. It's all part of growing up and learning.
Child: Okay, I get it. I'll ask if I get curious or confused about stuff. Thanks, Mom!","{'age': {'value': '13', 'definition': 'Chronological age of child used as an indicator of pubertal status and readiness for conversations of different depth (more depth as child gets older) and breadth (more breadth as child gets older)'}, 'embarrassment_level': {'value': 'low', 'definition': 'Degree of child’s discomfort or unease about conversations surrounding sexuality that may prevent open dialogue'}, 'parent_child_closeness_level': {'value': 'medium', 'definition': 'Degree of closeness and comfort with parent.'}, 'gender': {'value': 'male', 'definition': ""The child's gender identity.""}}","{'confidence_level': {'value': 'medium', 'definition': 'Degree of self-efficacy (i.e., confidence) in ability to effectively communicate with the child.'}, 'comfort_level': {'value': 'medium', 'definition': 'Degree of parent’s comfort or ease about conversations surrounding sexuality.'}, 'open_dialogue': {'value': 'high', 'definition': 'Degree to which parent engages in a direct and positive dialogue, as opposed to a closed and one-sided lecture'}, 'role': {'value': 'mother', 'definition': ""The parent's gender and role in the family.""}}","Parent: Hey buddy, I wanted to have a quick chat with you about something important. You might hear the word ""virginity"" sometimes. It's a term people use to talk about not having had sex yet. It’s okay to be curious and have questions about this stuff. If you ever want to talk or ask me anything, I'm here, okay?
Child: Um, okay. Thanks for telling me, Mom. I’ll let you know if I’ve got any questions.","{'age': {'value': '13', 'definition': 'Chronological age of child used as an indicator of pubertal status and readiness for conversations of different depth (more depth as child gets older) and breadth (more breadth as child gets older)'}, 'embarrassment_level': {'value': 'low', 'definition': 'Degree of child’s discomfort or unease about conversations surrounding sexuality that may prevent open dialogue'}, 'parent_child_closeness_level': {'value': 'medium', 'definition': 'Degree of closeness and comfort with parent.'}, 'gender': {'value': 'male', 'definition': ""The child's gender identity.""}}","{'confidence_level': {'value': 'medium', 'definition': 'Degree of self-efficacy (i.e., confidence) in ability to effectively communicate with the child.'}, 'comfort_level': {'value': 'medium', 'definition': 'Degree of parent’s comfort or ease about conversations surrounding sexuality.'}, 'open_dialogue': {'value': 'high', 'definition': 'Degree to which parent engages in a direct and positive dialogue, as opposed to a closed and one-sided lecture'}, 'role': {'value': 'mother', 'definition': ""The parent's gender and role in the family.""}}","Parent: Hey buddy, I wanted to chat with you about something important. Have you ever heard the term ""virginity""? It's okay if you haven't. It's a word people use to talk about whether someone has had a certain type of close relationship, like sex. What's important to know is that everyone thinks about it differently. It's normal to have questions or feel unsure, and you can always talk to me about anything, okay?
Child: Um, I think I've heard about it a little, but not really sure what it means. It's kinda weird to talk about. But, if it's important, I guess I can ask stuff if I need to.
Parent: I understand it might feel a little weird to talk about, but it's really okay to ask questions. Virginity is just a word people use to describe something personal. What's most important is how you feel about things as you grow up and learn. Everyone's journey is different, and you get to decide what feels right for you. Remember, I'm here if you want to talk or if you have questions later on.
Child: Okay, thanks for explaining, Mom. If I think of any questions, I'll let you know.","{'age': {'value': '13', 'definition': 'Chronological age of child used as an indicator of pubertal status and readiness for conversations of different depth (more depth as child gets older) and breadth (more breadth as child gets older)'}, 'embarrassment_level': {'value': 'low', 'definition': 'Degree of child’s discomfort or unease about conversations surrounding sexuality that may prevent open dialogue'}, 'parent_child_closeness_level': {'value': 'medium', 'definition': 'Degree of closeness and comfort with parent.'}, 'gender': {'value': 'male', 'definition': ""The child's gender identity.""}}","{'confidence_level': {'value': 'medium', 'definition': 'Degree of self-efficacy (i.e., confidence) in ability to effectively communicate with the child.'}, 'comfort_level': {'value': 'medium', 'definition': 'Degree of parent’s comfort or ease about conversations surrounding sexuality.'}, 'open_dialogue': {'value': 'high', 'definition': 'Degree to which parent engages in a direct and positive dialogue, as opposed to a closed and one-sided lecture'}, 'role': {'value': 'mother', 'definition': ""The parent's gender and role in the family.""}}"
