5,"Parent: Hey buddy, I wanted to have a quick chat with you about something important—virginity. It's about when someone decides to have sex for the first time. It's a personal choice, and it's okay to wait until you're ready. What's important is making sure that decision is right for you and that you're being safe and respectful. If you have any questions or want to talk more, I'm here for you.
Child: Okay, thanks for telling me, Mom. I'll let you know if I have any questions.
Parent: I'm glad you're open to talking about it. Just remember, it's okay to have questions, and it's normal to feel uncertain. Virginity and deciding to have sex is a big deal, and it's important to think about what feels right for you. You should never feel pressured by anyone to do something you're not ready for. Feel free to come to me anytime if you want to talk more or if there's anything else you're curious about.
Child: Thanks, Mom. I get it. It's kinda a lot to think about, but I know I can talk to you if I need to.",,,"Parent: Hey, I wanted to have a quick chat with you about something important. You might hear a lot about virginity and how it's viewed differently by people. It's really a personal thing, and there's no right or wrong way to think about it. Some people see it as a big deal, while others don't. The most important thing is that you feel comfortable and make decisions that are right for you. If you ever have questions or need to talk about it, I'm here to listen and support you, okay?
Child: Okay, thanks for letting me know. I’ll think about it and ask if I have questions.
Parent: I'm glad you're open to thinking about it and asking questions when you're ready. Just remember, it's important to respect yourself and others in any situation. If you ever feel uncertain or pressured, trust your instincts and know that it's okay to say no. I'm always here to help you navigate this stuff.
Child: Child: Yeah, I get it. I'll keep that in mind. Thanks for being there, Mom.",,,"Parent: Hey buddy, I wanted to have a quick chat about something important. Virginity is a concept that people often talk about, but it’s really about when you feel ready to take that step. It’s important to make sure it’s a decision you’re comfortable with and not something you feel pressured to do. If you have any questions or need advice, I'm always here to talk, okay?
Child: Okay, thanks for telling me, Mom. I’ll let you know if I have questions.
Parent: I'm really glad to hear that. Just remember, everyone’s journey is different, and there’s no rush to figure everything out. What’s most important is that you feel comfortable and safe. If you ever want to talk more about it or anything else, I’m here for you.
Child: Thanks, Mom. I get it. It's good to know you're here if I need to talk.",,,"Parent: ""Hey buddy, I wanted to talk to you about something important today. You might hear the word 'virginity' as you get older. It's just a word people use to talk about the first time someone chooses to have sex. It's okay if you don't know much about it right now, but if you ever have questions or feel curious, you can always come to me. It's important to understand things at your own pace, and I'm here to help whenever you need.""
Child: Okay, thanks, Mom. I don't really have any questions right now, but I'll let you know if I do later.
Parent: That's totally fine, sweetie. Just remember, I'm always here if you get curious or hear something you want to talk about. It's normal to have questions as you grow up, and there's no rush. We can chat about anything when you're ready.
Child: Thanks, Mom. I'll remember that.","{'age': {'value': '13', 'definition': 'Chronological age of child used as an indicator of pubertal status and readiness for conversations of different depth (more depth as child gets older) and breadth (more breadth as child gets older)'}, 'embarrassment_level': {'value': 'low', 'definition': 'Degree of child’s discomfort or unease about conversations surrounding sexuality that may prevent open dialogue'}, 'parent_child_closeness_level': {'value': 'medium', 'definition': 'Degree of closeness and comfort with parent.'}, 'gender': {'value': 'male', 'definition': ""The child's gender identity.""}}","{'confidence_level': {'value': 'medium', 'definition': 'Degree of self-efficacy (i.e., confidence) in ability to effectively communicate with the child.'}, 'comfort_level': {'value': 'medium', 'definition': 'Degree of parent’s comfort or ease about conversations surrounding sexuality.'}, 'open_dialogue': {'value': 'high', 'definition': 'Degree to which parent engages in a direct and positive dialogue, as opposed to a closed and one-sided lecture'}, 'role': {'value': 'mother', 'definition': ""The parent's gender and role in the family.""}}","Parent: Hey buddy, I wanted to talk to you about something important. You know, virginity is often talked about as a big deal, but it really comes down to personal choice and how you feel about it. Everyone has their own views, and that's okay. The important thing is to make sure you're ready and informed before deciding to have sex. It's crucial to think about your health and well-being, and that includes using protection. If you have any questions or need to talk, I'm always here for you.
Child: Okay, Mom. Thanks for telling me. I'll let you know if I have any questions.
Parent: I'm glad you're open to talking about this, buddy. Just remember, it's all about what feels right for you. Everyone's journey is different, and there's no rush. The most important thing is to be informed and make choices that are safe and comfortable for you. If you ever have more thoughts or questions, you know I'm here to chat.
Child: Got it, Mom. I'll think about it and ask if I need help. Thanks for being there.",,,"Parent: Hey buddy, I wanted to talk to you about something important. You might hear the word ""virginity"" from friends or on TV. It's a concept about someone's first time having sex. People have different beliefs about it, and that's okay. What really matters is that when you're older, you make choices that you feel good about and that keep you safe. You can always talk to me if you have questions or if something confuses you, alright?
Child: Um, okay. Thanks for telling me, Mom. I guess I don't have any questions right now, but I'll let you know if I do.
Parent: Sure thing, buddy. And remember, everyone has their own ideas about what virginity means to them. It's important to think about what feels right for you as you get older. You should never feel pressured to do anything you're not ready for. And like I said, I'm always here if you want to talk or if something doesn't make sense. It's okay to have questions or be curious about these things.
Child: Okay, thanks for explaining, Mom. I'll think about it and let you know if I have any questions later.","{'age': {'value': '13', 'definition': 'Chronological age of child used as an indicator of pubertal status and readiness for conversations of different depth (more depth as child gets older) and breadth (more breadth as child gets older)'}, 'embarrassment_level': {'value': 'low', 'definition': 'Degree of child’s discomfort or unease about conversations surrounding sexuality that may prevent open dialogue'}, 'parent_child_closeness_level': {'value': 'medium', 'definition': 'Degree of closeness and comfort with parent.'}, 'gender': {'value': 'male', 'definition': ""The child's gender identity.""}}","{'confidence_level': {'value': 'medium', 'definition': 'Degree of self-efficacy (i.e., confidence) in ability to effectively communicate with the child.'}, 'comfort_level': {'value': 'medium', 'definition': 'Degree of parent’s comfort or ease about conversations surrounding sexuality.'}, 'open_dialogue': {'value': 'high', 'definition': 'Degree to which parent engages in a direct and positive dialogue, as opposed to a closed and one-sided lecture'}, 'role': {'value': 'mother', 'definition': ""The parent's gender and role in the family.""}}","Parent: Hey buddy, I wanted to talk with you about something important today. Have you heard the word ""virginity"" before? It's okay if you haven't. Virginity is just a way some people talk about whether or not someone has had sex, which is something people usually do when they're older. It’s perfectly fine not to know much about it right now, but I want you to know that if you ever have questions or just want to talk about these things, you can always come to me, okay? There’s no rush to know everything right now, just know that I'm here to help you understand when you're ready.
Child: Um, I think I've heard it before, but I don't really know what it means. Thanks for telling me, Mom. I'll ask if I get curious.
Parent: That's okay, sweetie. It's great that you're open to asking questions. Just remember, everyone's journey is different, and there's no need to worry about it now. It's good to take your time to learn about these things when you feel ready. If you ever feel curious or want to talk more, just let me know. We can always have a chat, no pressure.
Child: Okay, thanks, Mom. I'll let you know if I wanna talk about it more.","{'age': {'value': '13', 'definition': 'Chronological age of child used as an indicator of pubertal status and readiness for conversations of different depth (more depth as child gets older) and breadth (more breadth as child gets older)'}, 'embarrassment_level': {'value': 'low', 'definition': 'Degree of child’s discomfort or unease about conversations surrounding sexuality that may prevent open dialogue'}, 'parent_child_closeness_level': {'value': 'medium', 'definition': 'Degree of closeness and comfort with parent.'}, 'gender': {'value': 'male', 'definition': ""The child's gender identity.""}}","{'confidence_level': {'value': 'medium', 'definition': 'Degree of self-efficacy (i.e., confidence) in ability to effectively communicate with the child.'}, 'comfort_level': {'value': 'medium', 'definition': 'Degree of parent’s comfort or ease about conversations surrounding sexuality.'}, 'open_dialogue': {'value': 'high', 'definition': 'Degree to which parent engages in a direct and positive dialogue, as opposed to a closed and one-sided lecture'}, 'role': {'value': 'mother', 'definition': ""The parent's gender and role in the family.""}}","Parent: Hey buddy, I wanted to talk to you about something that might come up as you get older. You might hear people talking about virginity. It's a word that means different things to different people and every person has their own feelings about it. The important thing is to know that it's okay to have questions and that you can always come to me if you want to talk about anything like that. We can figure it out together, okay?
Child: Um, okay, Mom. Thanks for telling me. I guess if I have questions, I'll let you know.
Parent: Sure thing, just remember, it's perfectly normal to feel a bit unsure or embarrassed about these topics, and you're not alone in that. Everyone has their own thoughts and feelings about virginity, and it's okay to be curious. If you ever hear something from friends or see something online that you're not sure about, you can always ask me. We can talk about it whenever you're ready, no rush.
Child: Okay, Mom. I get it. I'll ask if I hear anything weird. Thanks.","{'age': {'value': '13', 'definition': 'Chronological age of child used as an indicator of pubertal status and readiness for conversations of different depth (more depth as child gets older) and breadth (more breadth as child gets older)'}, 'embarrassment_level': {'value': 'low', 'definition': 'Degree of child’s discomfort or unease about conversations surrounding sexuality that may prevent open dialogue'}, 'parent_child_closeness_level': {'value': 'medium', 'definition': 'Degree of closeness and comfort with parent.'}, 'gender': {'value': 'male', 'definition': ""The child's gender identity.""}}","{'confidence_level': {'value': 'medium', 'definition': 'Degree of self-efficacy (i.e., confidence) in ability to effectively communicate with the child.'}, 'comfort_level': {'value': 'medium', 'definition': 'Degree of parent’s comfort or ease about conversations surrounding sexuality.'}, 'open_dialogue': {'value': 'high', 'definition': 'Degree to which parent engages in a direct and positive dialogue, as opposed to a closed and one-sided lecture'}, 'role': {'value': 'mother', 'definition': ""The parent's gender and role in the family.""}}"
6,"Parent: Hey buddy, I wanted to chat with you about something important. You might have heard the term ""virginity"" before, and I just want you to know that it's okay to have questions. Virginity is often talked about as the first time someone has sex, but what's really important is understanding your own feelings and making choices that are right for you. It's a personal decision, and there's no rush. Whenever you feel ready to talk more about it or have questions, I'm here to listen and help.
Child: Okay, thanks for telling me, Mom. I don't have questions right now, but it's good to know I can ask you later.",,,"Parent: Hey buddy, I wanted to chat about something important—virginity. Society often makes it seem like a huge deal, especially for women, but it's really a personal thing. Some people feel pressured by it, while others see it differently. What's most important is that you feel comfortable and make choices that are right for you when you're ready. If you ever have questions or just want to talk, I'm here for you.
Child: Okay, Mom. Thanks for talking to me about it. It's kinda confusing, but I get that it's up to me to decide when I'm ready. I'll let you know if I have any questions.",,,"Parent: Hey buddy, I wanted to talk to you about something important—it's about virginity and what it means. It's normal to have questions about it, and there's a lot of different ideas about what it means. Basically, virginity is about whether or not you've had sex before. But what's more important is understanding that this is a personal choice, and it's okay to wait until you feel ready. It's also important to respect others' choices about it too. If you have any questions or thoughts, I'm here to talk about it anytime.
Child: Okay, I get it. Thanks for talking to me about it, Mom. If I have questions later, I'll ask.",,,"Parent: Hey buddy, I wanted to chat about something important. Have you ever heard the word ""virginity"" before? It's a bit confusing, but it's just a term people use to describe whether someone has had sex yet. You don't need to worry about it now, but it's good to know that everyone's experience is different and that's okay. If you ever have questions about it or anything else, you can always ask me, alright?
Child: Um, yeah, I've heard of it. I guess it's kinda weird to think about. Thanks for telling me, Mom. I'll let you know if I have questions.","{'age': {'value': '13', 'definition': 'Chronological age of child used as an indicator of pubertal status and readiness for conversations of different depth (more depth as child gets older) and breadth (more breadth as child gets older)'}, 'embarrassment_level': {'value': 'low', 'definition': 'Degree of child’s discomfort or unease about conversations surrounding sexuality that may prevent open dialogue'}, 'parent_child_closeness_level': {'value': 'medium', 'definition': 'Degree of closeness and comfort with parent.'}, 'gender': {'value': 'male', 'definition': ""The child's gender identity.""}}","{'confidence_level': {'value': 'medium', 'definition': 'Degree of self-efficacy (i.e., confidence) in ability to effectively communicate with the child.'}, 'comfort_level': {'value': 'medium', 'definition': 'Degree of parent’s comfort or ease about conversations surrounding sexuality.'}, 'open_dialogue': {'value': 'high', 'definition': 'Degree to which parent engages in a direct and positive dialogue, as opposed to a closed and one-sided lecture'}, 'role': {'value': 'mother', 'definition': ""The parent's gender and role in the family.""}}","Parent: Hey buddy, I wanted to talk to you about something important today—virginity. It's often seen as a big milestone, but what's most important is what it means to you personally. Some people choose to have their first sexual experience casually, while others might wait for someone special. There's no right or wrong choice, just what's right for you. Remember, it's important to be safe and respectful, both to yourself and others. If you ever have questions or need to talk, I'm here for you.
Child: Mom, I get what you're saying. I think it's cool you're open about stuff like this. I'll keep it in mind and let you know if I have questions. Thanks for being there.",,,"Parent: Hey buddy, I wanted to have a quick chat with you about something called virginity. It's a word you might hear as you get older, and it can mean different things to different people. Some folks think it's important, and others don't give it much thought. It's all about what feels right for you when you're older. If you ever have questions or just want to talk about it, I'm always here to chat, okay?
Child: Okay, thanks for telling me, Mom. I don't really know much about it, but I'll let you know if I have questions.","{'age': {'value': '13', 'definition': 'Chronological age of child used as an indicator of pubertal status and readiness for conversations of different depth (more depth as child gets older) and breadth (more breadth as child gets older)'}, 'embarrassment_level': {'value': 'low', 'definition': 'Degree of child’s discomfort or unease about conversations surrounding sexuality that may prevent open dialogue'}, 'parent_child_closeness_level': {'value': 'medium', 'definition': 'Degree of closeness and comfort with parent.'}, 'gender': {'value': 'male', 'definition': ""The child's gender identity.""}}","{'confidence_level': {'value': 'medium', 'definition': 'Degree of self-efficacy (i.e., confidence) in ability to effectively communicate with the child.'}, 'comfort_level': {'value': 'medium', 'definition': 'Degree of parent’s comfort or ease about conversations surrounding sexuality.'}, 'open_dialogue': {'value': 'high', 'definition': 'Degree to which parent engages in a direct and positive dialogue, as opposed to a closed and one-sided lecture'}, 'role': {'value': 'mother', 'definition': ""The parent's gender and role in the family.""}}","Parent: Hey buddy, I wanted to chat with you about something important. You might have heard the word ""virginity"" before. It's a way some people talk about not having had sex yet. You're still young, so you don't need to worry about this stuff right now, but it's good to start understanding things early. If you ever have questions about this or anything else, just know you can always ask me, okay?
Child: Um, okay. Thanks for telling me, Mom. I'll let you know if I have any questions.
Parent: I'm glad you're open to asking questions, buddy. Just remember, it's okay to feel a bit awkward or embarrassed about this stuff—it's totally normal. Whenever you're curious or hear something from friends or online that you don't quite understand, you can always come to me. We can figure things out together, no rush.
Child: Okay, thanks, Mom. I'll try to remember that.
Parent: I'm really proud of you for being open, buddy. Remember, it's totally normal to have questions as you start learning more about things like virginity and growing up. If something pops into your mind, don't hesitate to chat with me. It's important to me that we can talk about anything, no matter how awkward it might seem. You're doing great, just being open to talking is a big step!
Child: Okay, I'll try to remember to ask if I hear anything weird. Thanks, Mom.
Parent: Of course, buddy. It's completely normal to have some weird or confusing things come up, especially as you get older and hear more from friends or online. Just remember, there's no rush, and I'm always here to help you understand things better when you're curious. You're doing great just by being willing to talk and ask. We've got this together, okay?
Child: Okay, got it. Thanks, Mom. I'll keep it in mind.
Parent: I'm really glad you're keeping this in mind, buddy. Just remember, there's no such thing as a silly question when it comes to understanding things about growing up and virginity. It's all part of learning, and I'm here to help however I can. So whenever you're curious, just let me know, and we'll figure it out together. You're doing awesome!
Child: Thanks, Mom. I'll remember to ask if I need to.","{'age': {'value': '13', 'definition': 'Chronological age of child used as an indicator of pubertal status and readiness for conversations of different depth (more depth as child gets older) and breadth (more breadth as child gets older)'}, 'embarrassment_level': {'value': 'low', 'definition': 'Degree of child’s discomfort or unease about conversations surrounding sexuality that may prevent open dialogue'}, 'parent_child_closeness_level': {'value': 'medium', 'definition': 'Degree of closeness and comfort with parent.'}, 'gender': {'value': 'male', 'definition': ""The child's gender identity.""}}","{'confidence_level': {'value': 'medium', 'definition': 'Degree of self-efficacy (i.e., confidence) in ability to effectively communicate with the child.'}, 'comfort_level': {'value': 'medium', 'definition': 'Degree of parent’s comfort or ease about conversations surrounding sexuality.'}, 'open_dialogue': {'value': 'high', 'definition': 'Degree to which parent engages in a direct and positive dialogue, as opposed to a closed and one-sided lecture'}, 'role': {'value': 'mother', 'definition': ""The parent's gender and role in the family.""}}","Parent: Hey buddy, I wanted to talk to you about something called virginity. It's a word that comes up sometimes when people talk about their first sexual experience. It's important to know that everyone thinks about it differently, and that's okay. Some people think it's a big deal, and some don't. What's most important is that you understand your own feelings and make choices that are right for you when you're older. If you ever have questions or want to talk more about this stuff, I'm always here to chat.
Child: Um, okay. Thanks for telling me, Mom. I kinda get it, but it's a little weird to think about. I'll let you know if I have questions.","{'age': {'value': '13', 'definition': 'Chronological age of child used as an indicator of pubertal status and readiness for conversations of different depth (more depth as child gets older) and breadth (more breadth as child gets older)'}, 'embarrassment_level': {'value': 'low', 'definition': 'Degree of child’s discomfort or unease about conversations surrounding sexuality that may prevent open dialogue'}, 'parent_child_closeness_level': {'value': 'medium', 'definition': 'Degree of closeness and comfort with parent.'}, 'gender': {'value': 'male', 'definition': ""The child's gender identity.""}}","{'confidence_level': {'value': 'medium', 'definition': 'Degree of self-efficacy (i.e., confidence) in ability to effectively communicate with the child.'}, 'comfort_level': {'value': 'medium', 'definition': 'Degree of parent’s comfort or ease about conversations surrounding sexuality.'}, 'open_dialogue': {'value': 'high', 'definition': 'Degree to which parent engages in a direct and positive dialogue, as opposed to a closed and one-sided lecture'}, 'role': {'value': 'mother', 'definition': ""The parent's gender and role in the family.""}}"
